{
  "schema_version": "1.0.0",
  "policy_id": "POL-001",
  "title": "Access Control Policy",
  "status": "approved",
  "version": "3.2",
  "owner": {
    "team": "Security Governance"
  },
  "approvers": [
    {
      "name": "Taylor Brooks",
      "email": "taylor@example.com"
    }
  ],
  "document_path": "policies/access-control-policy.md",
  "effective_at": "2026-04-01T00:00:00Z",
  "next_review_at": "2027-04-01T00:00:00Z",
  "review_interval_days": 365,
  "framework_refs": [
    "soc2",
    "iso27001",
    "fedramp-moderate"
  ],
  "control_refs": [
    "SCF-IAC-01",
    "SCF-IAC-15"
  ]
}
